{
  "$schema":"https://json-schema.org/draft/2020-12/schema",
  "$id":"app-config.schema.json",
  "description":"Meta-schema validating the shape of loop/product/app-config.schema.json (a JSON Schema document in its own right, describing the product AppConfig persisted JSON contract). Deliberately shallow: it checks that the document looks like a well-formed schema (has $schema/schema_version/type/required/properties/additionalProperties of the right JSON types) without recursively re-validating every nested JSON-Schema keyword -- consistent with the rest of loop/schemas, none of which self-validate either.",
  "type":"object",
  "required":["schema_version","title","type","required","properties","additionalProperties"],
  "properties":{
    "$schema":{"type":"string"},
    "$id":{"type":"string"},
    "schema_version":{"type":"string","const":"1.0.0"},
    "title":{"type":"string","minLength":1},
    "description":{"type":"string"},
    "type":{"type":"string","const":"object"},
    "required":{"type":"array","minItems":1},
    "properties":{"type":"object"},
    "additionalProperties":{"type":"boolean","const":false}
  },
  "additionalProperties":false
}
